FIN<GER LAKES - May 14, 2024 - Race 1
ALLOWANCE - Thoroughbred
FOR FOALED IN NEW YORK STATE AND APPROVED BY THE NEW YORK STATE-BRED REGISTRY FILLIES AND MARES
THREE YEARS OLD AND UPWARD WHICH HAVE NOT WON A STATE BRED RACE OTHER THAN MAIDEN, CLAIMING, OR
STARTER. Three Year Olds, 120 lbs.; Older, 124 lbs. Non-winners Of A Race Since March 14 Allowed 2 lbs. (Claiming Races For
$15,000 Or Less Not Considered In Allowances). (SNW1 B X)
Distance: Six Furlongs On The Dirt Current Track Record: (Kelly Kip - 1:08.20 - June 20, 1998)
Purse: $24,500
Available Money: $24,500
Value of Race: $24,500 1st $14,700, 2nd $4,900, 3rd $2,695, 4th $1,470, 5th $735
Weather: Clear, 74° Track: Fast
Off at: 1:19 Start: Good for all Timing Method: Electronic
Video Race Replay
Last Raced
Pgm Horse Name (Jockey)
Wgt M/E
PP
Start
1/4
1/2
Str
Fin
Odds Comments
28Apr24 5AQU5
3
Capital Gal (Davis, Jacqueline)
122
L
3
2
43
21
11/2
13 1/2
3.80
4w trn,drew clear
30Apr24 7FL3
2
Darn That Song (Harkie, Heman)
122
L
2
3
11
1Head
22 1/2
21 1/4
1.00*
2p trn,second best
29Apr24 2FL3
4
Mrs Bell (Diaz, Juan)
119
L b
4
4
5
5
31/2
33 3/4
18.60
4w trn,no solid bid
29Apr24 2FL2
5
Remoane (De Diego, Emanuel)
122
L f
5
1
32 1/2
31/2
41/2
42 1/2
13.00
shrp st,3p trn,tired
30Apr24 7FL4
1
Lockbox (Perez, Luis)
122
L bf
1
5
21/2
42
5
5
1.50
rail trn,tired
Fractional Times: 22.71
46.34
58.98
Final Time: 1:12.24
Split Times:
(23:63) (12:64)
(13:26)
Run-Up: 30 feet
Winner:
Capital Gal, Bay Mare, by Constitution out of Big Thrill, by Big Drama. Foaled Mar 12, 2019 in New York.
Breeder: Twin Creeks Farm
Owner: Dark Horse Racing Stable
Trainer: Breed, Jr., Ronald
Total WPS Pool: $54,638
Pgm Horse
Win
Place
Show
3
Capital Gal
9.60
3.60
2.70
2
Darn That Song
2.40
2.10
4
Mrs Bell
3.90
Wager Type
Winning Numbers
Payoff
Pool
$2.00 Exacta
3-2
22.00
32,988
$0.10 Superfecta
3-2-4-5
14.47
10,411
$0.50 Trifecta
3-2-4
29.75
20,733
Past Performance Running Line Preview
Pgm Horse Name
Start
1/4
1/2
Str
Fin
3
Capital Gal
2
44
2Head
11/2
13 1/2
2
Darn That Song
3
11
1Head
21/2
23 1/2
4
Mrs Bell
4
57
53 1/2
33
34 3/4
5
Remoane
1
31 1/2
31
43 1/2
48 1/2
1
Lockbox
5
21
41 1/2
54
511
Trainers: 3 - Breed, Jr., Ronald; 2 - Sells, Rachel; 4 - Dean, III, Victor; 5 - Lopez, Arcadio; 1 - D'Alessandro, Ralph
Owners:
3 - Dark Horse Racing Stable; 2 - Eddie F's Racing; 4 -Victor Dean III; 5 -Angel G. Lopez; 1 -Adrianne N. D'Alessandro;
Footnotes
CAPITAL GAL In hand four wide, gained on that path to reach the leader, responded, put that one away and drew clear. DARN THAT SONG Set the pace
along the two path, was collared, battled to no avail but bested the rest. MRS BELL Unhurried four wide on the turn, angled out and failed to gain.
REMOANE Away best, tracked along the three path and tired. LOCKBOX Tracked along the two path early, saved ground on the turn and was with a
furlong to go.
Copyright 2024 Equibase Company LLC. All Rights Reserved.
FIN[GER LAKES - May 14, 2024 - Race 2
CLAIMING - Thoroughbred
FOR FILLIES AND MARES THREE YEARS OLD AND UPWARD WHICH HAVE NEVER WON TWO RACES. Three Year Olds,
119 lbs.; Older, 124 lbs. Claiming Price $5,000. (NW2 L) Claiming Price: $5,000
Distance: Five Furlongs On The Dirt Current Track Record: (Wonderous Wise - 57.20 - April 11, 1989)
Purse: $13,700
Available Money: $13,700
Value of Race: $13,700 1st $8,220, 2nd $2,740, 3rd $1,370, 4th $685, 5th $411, 6th $274
Weather: Clear, 74° Track: Fast
Off at: 1:51 Start: Good for all Timing Method: Electronic
Video Race Replay
Last Raced
Pgm Horse Name (Jockey)
Wgt M/E
PP
Start
3/16
3/8
Str
Fin
Odds Comments
14Nov23 6FL2
4
Moolah Rouge (Coa, Keiber)
124
L bf
4
3
43
3Head
31 1/2
1Head
1.05*
4w trn,up in time
30Apr24 8FL8
2
Cause I'm Elegant (Davila, Jr., John)
124
L f
2
2
21
21 1/2
1Head
21 1/2
4.20
2p trn,caught late
14Nov23 6FL5
1
Sweet Tooth Sue (Rohena, Jr., Rafael)
124
L
1
1
11/2
11/2
21 1/2
33/4
4.60
faded inside
30Apr24 8FL6
5
Sassy Tallahassee (Camilo, Carlos)
124
L bf
5
5
51/2
52
41
43 1/4
3.50
rail turn,evenly
30Apr24 8FL7
6
Alarra (Fret, Steven)
124
L
6
6
6
6
6
51
14.10
2p trn,no response
22Nov23 4FL1
3
Becauseofthebrave (Rodriguez, Anthony)
124
L bf
3
4
31/2
41
51
6
10.70
3p trn,tired
Fractional Times: 22.71
47.22
Final Time: 1:00.76
Split Times:
(24:51) (13:54)
Run-Up: 50 feet
Winner:
Moolah Rouge, Bay Filly, by Redesdale out of Kashin Miami, by Kiridashi. Foaled Mar 09, 2020 in New York.
Breeder: Michael Slezak
Owner: Michael A. LeCesse
Trainer: LeCesse, Michael
Claiming Prices:
2 - Cause I'm Elegant: $5,000; 5 - Sassy Tallahassee: $5,000; 6 - Alarra: $5,000; 3 - Becauseofthebrave: $5,000;
Total WPS Pool: $40,036
Pgm Horse
Win
Place
Show
4
Moolah Rouge
4.10
2.50
2.20
2
Cause I'm Elegant
4.00
3.50
1
Sweet Tooth Sue
3.60
Wager Type
Winning Numbers
Payoff
Pool
$2.00 Daily Double
3-4
26.40
16,852
$2.00 Exacta
4-2
19.60
40,318
$0.10 Superfecta
4-2-1-5
7.77
14,483
$0.50 Trifecta
4-2-1
17.62
25,646
Past Performance Running Line Preview
Pgm Horse Name
Start
3/16
3/8
Str
Fin
4
Moolah Rouge
3
42
32
31 1/2
1Head
2
Cause I'm Elegant
2
21/2
21/2
1Head
2Head
1
Sweet Tooth Sue
1
11/2
11/2
2Head
31 1/2
5
Sassy Tallahassee
5
55
53
43
42 1/4
6
Alarra
6
65 1/2
65
65
55 1/2
3
Becauseofthebrave
4
31 1/2
42
54
66 1/2
Trainers: 4 - LeCesse, Michael; 2 - Wadams, Dewight; 1 - Marino, Joseph; 5 - Sells, Rachel; 6 - Clarke, Matthew; 3 - Clarke, Matthew
Owners:
4 -Michael A. LeCesse; 2 -Dewight J. Wadams; 1 -Joseph E. Marino; 5 -Rachel Sells; 6 - BoBo Racing Group; 3 - Circle B Racing;
Footnotes
MOOLAH ROUGE In hand four wide on the turn, angled out, asked, gained and nailed CAUSE I'M ELEGANT on the wire. CAUSE I'M ELEGANT Contested
the lead along the two path, battled with the lead and was caught on the wire. SWEET TOOTH SUE Away best, set the pace along the rail while pressed,
battled inside and faded. SASSY TALLAHASSEE Unhurried along the rail on the turn, eased out and finished evenly. ALARRA Unhurried along the two
path, angled out and failed to gain. BECAUSEOFTHEBRAVE Close up along the three path to the lane and tired.
Copyright 2024 Equibase Company LLC. All Rights Reserved.
FINGER LAKES< - May 14, 2024 - Race 3
ALLOWANCE - Thoroughbred
FOR FILLIES AND MARES THREE YEARS OLD AND UPWARD WHICH HAVE NEVER WON TWO RACES. Three Year Olds,
120 lbs.; Older, 124 lbs. (NW2 L)
Distance: Five Furlongs On The Dirt Current Track Record: (Wonderous Wise - 57.20 - April 11, 1989)
Purse: $26,500
Includes: $3,500 NYSTBDF - New York TB Breeding Development Fund
Available Money: $26,500
Value of Race: $26,500 1st $15,900, 2nd $5,300, 3rd $2,915, 4th $1,590, 5th $795
Weather: Clear, 74° Track: Fast
Off at: 2:21 Start: Good for all Timing Method: Electronic
Video Race Replay
Last Raced
Pgm Horse Name (Jockey)
Wgt M/E
PP
Start
3/16
3/8
Str
Fin
Odds Comments
6May24 5FL2
1
Bustin Time (Davis, Jacqueline)
120
L
1
3
11/2
11
13 1/2
14 1/2
0.35*
2p trn,kept to whip
27Sep23 3FL1
3
Sheza Bernardini (De Diego, Emanuel)
120
- -
3
5
41
41 1/2
43
2Neck
5.40
slgsh st,4w turn
21Nov23 3FL4
5
Ma Mi Jo Dreams (Navarro, Kevin)
124
L b
5
2
21
23 1/2
22 1/2
31 1/2
8.50
3p trn,missed place
14Apr24 9AQU1
4
Necessaryandproper (Coa, Keiber)
120
- -
4
1
31
31
3Head
43 3/4
5.70
3p trn,wkn inside
21Nov23 7FL1
2
Our First Lady (Perez, Luis)
124
L b
2
4
5
5
5
5
12.60
2p trn,tired
Fractional Times: 22.94
47.27
Final Time: 1:00.27
Split Times:
(24:33) (13:00)
Run-Up: 50 feet
Winner:
Bustin Time, Chestnut Filly, by Bustin Stones out of Myakka City, by City Place. Foaled Mar 19, 2021 in New York.
Winner's sire standing at Waldorf Farm, North Chatham, NY
Breeder: Mr Armore Stables
Owner: John P. Mc Allen
Trainer: Davis, Robbie
Total WPS Pool: $52,000
Pgm Horse
Win
Place
Show
1
Bustin Time
2.70
2.30
2.10
3
Sheza Bernardini
4.00
3.10
5
Ma Mi Jo Dreams
2.80
Wager Type
Winning Numbers
Payoff
Pool
$2.00 Daily Double
4-1
8.20
7,429
$2.00 Exacta
1-3
8.40
36,853
$0.10 Superfecta
1-3-5-4
1.68
9,838
$0.50 Trifecta
1-3-5
4.50
17,606
Past Performance Running Line Preview
Pgm Horse Name
Start
3/16
3/8
Str
Fin
1
Bustin Time
3
11/2
11
13 1/2
14 1/2
3
Sheza Bernardini
5
42 1/2
45 1/2
46
24 1/2
5
Ma Mi Jo Dreams
2
21/2
21
23 1/2
34 3/4
4
Necessaryandproper
1
31 1/2
34 1/2
36
46 1/4
2
Our First Lady
4
53 1/2
57
59
510
Trainers: 1 - Davis, Robbie; 3 - Englehart, Jeremiah; 5 - Buckley, Jonathan; 4 - Ferraro, M.; 2 - Acquilano, James
Owners:
1 -John P. Mc Allen; 3 - Allread, Neal M., Englehart, Jesse J. and Langlais, Dan; 5 - Clear Stars Stable, Mitre Box Stable and Koshanostra
Stables; 4 -Clark O. Brewster; 2 -Keith Dickstein;
Footnotes
BUSTIN TIME Vied for the lead along the two path, cleared at the top of the lane and then widened some while under the whip. SHEZA BERNARDINI Broke
sluggishly, in hand four wide on the bend, angled out and closed well late. MA MI JO DREAMS Forced the issue along the three path, chased into the lane
and then failed to secure the place. NECESSARYANDPROPER Well placed along the three path, angled in and weakened. OUR FIRST LADY Unhurried
along the two path and tired.
Denotes OBS Graduate
Copyright 2024 Equibase Company LLC. All Rights Reserved.
FI/NGER LAKES - May 14, 2024 - Race 4
CLAIMING - Thoroughbred
FOR FILLIES AND MARES THREE YEARS OLD AND UPWARD WHICH HAVE NOT WON TWO RACES SINCE MAY 14, 2023
OR WHICH HAVE NEVER WON FOUR RACES. Three Year Olds, 119 lbs.; Older, 124 lbs. Non-winners Of A Race Since March 14
Allowed 2 lbs. Claiming Price $5,000 (Claiming Races For $4,500 Or Less Not Considered In Eligibility). ( C) Claiming Price:
$5,000
Distance: Five And One Half Furlongs On The Dirt Current Track Record: (Hilary Star - 1:02.80 - April 16, 1989)
Purse: $14,000
Available Money: $14,000
Value of Race: $14,000 1st $8,400, 2nd $2,800, 3rd $1,400, 4th $700, 5th $420, 6th $280
Weather: Clear, 74° Track: Fast
Off at: 2:52 Start: Good for all Timing Method: Electronic
Video Race Replay
Last Raced
Pgm Horse Name (Jockey)
Wgt M/E
PP
Start
1/4
3/8
Str
Fin
Odds Comments
30Apr24 2FL1
5
Wartapped (Perez, Luis)
124
L bf
3
3
3Head
1Head
11
1Head
0.20*
3p trn,btw1/4,lasted
22Nov23 8FL4
2
Sweet Invasion (Coa, Keiber)
122
- -
2
5
53
56
4Head
22 1/4
5.30
2p3/8,4w1/4,rallied
4Oct23 8FL3
1
True Destiny (Davila, Jr., John)
122
L
1
4
2Head
41
55
31/2
10.10
rail trn,passd faders
29Apr24 5FL5
6
Crosstalk (De Diego, Emanuel)
122
L b
4
2
11
21/2
21 1/2
4Head
10.30
2p trn, weakened
29Apr24 5FL4
8
Christmas Dinner (Rohena, Jr., Rafael)
122
L
6
1
42
31
31
51 1/4
18.80
4w trn, weakened
29Apr24 2FL5
7
Thefabulous Moolah (Worrie, Andre)
122
L bf
5
6
6
6
6
6
33.50
2p trn, no factor
Fractional Times: 23.47
48.00
1:00.92
Final Time: 1:07.76
Split Times:
(24:53) (12:92)
(6:84)
Run-Up: 56 feet
Winner:
Wartapped, Dark Bay or Brown Filly, by War Dancer out of Untapped Secret, by Read the Footnotes. Foaled Feb 01, 2020 in New York.
Winner's sire standing at Irish Hill & Dutchess Views Stallions
Breeder: My Purple Haze Stables, LLC
Owner: J and M Racing Stables
Trainer: Ferraro, Michael
Voided Claims:
Wartapped(Vet)
Claiming Prices:
5 - Wartapped: $5,000; 6 - Crosstalk: $5,000; 8 - Christmas Dinner: $5,000; 7 - Thefabulous Moolah: $5,000;
Scratched Horse(s): Jackie B Good (Veterinarian), Run Laura Run (Veterinarian)
Total WPS Pool: $50,778
Pgm Horse
Win
Place
Show
5
Wartapped
2.40
2.10
2.10
2
Sweet Invasion
3.00
2.20
1
True Destiny
2.80
Wager Type
Winning Numbers
Payoff
Pool
$0.50 Pick 3
4-1-5 (3 correct)
2.45
11,824
$0.50 Pick 4
3-4-1-ALL (4 correct)
14.37
34,285
$2.00 Daily Double
1-5
4.10
10,213
$2.00 Exacta
5-2
5.30
42,262
$0.10 Superfecta
5-2-1-6
3.25
13,414
$0.50 Trifecta
5-2-1
6.35
25,360
Past Performance Running Line Preview
Pgm Horse Name
Start
1/4
3/8
Str
Fin
5
Wartapped
3
31
1Head
11
1Head
2
Sweet Invasion
5
53 1/4
52 1/2
43 1/2
2Head
1
True Destiny
4
21
41 1/2
53 1/2
32 1/4
6
Crosstalk
2
11
2Head
21
42 3/4
8
Christmas Dinner
1
41 1/4
31/2
32 1/2
53
7
Thefabulous Moolah
6
66 1/4
68 1/2
68 1/2
64 1/4
Trainers: 5 - Ferraro, Michael; 2 - Acquilano, James; 1 - Reed, Lisa; 6 - Sells, Rachel; 8 - Breed, Debra; 7 - Morales, Samuel
Owners:
5 - J and M Racing Stables; 2 - Peekaboo Stable; 1 -Lisa A. Reed; 6 - Sparling, Richard and Colony, Pamela C.; 8 -Debra A. Breed; 7 -Maria T.
Hiraldo;
Footnotes
WARTAPPED Tracked along the three path, challenged from between, kicked clear and lasted. SWEET INVASION Unhurried along the two path into the
turn, four wide leaving it and rallied. TRUE DESTINY Tracked inside, dropped back some into the turn, angled out and passed faders. CROSSTALK Set the
pace along the two path, was collared, chased and weakened. CHRISTMAS DINNER Close up four wide into the lane and weakened. THEFABULOUS
MOOLAH Lagged back, two path on the turn, angled out and failed to take part.
Copyright 2024 Equibase Company LLC. All Rights Reserved.
FINGER
*LAKES - May 14, 2024 - Race 5
CLAIMING - Thoroughbred
FOR THREE YEAR OLDS AND UPWARD WHICH HAVE NOT WON TWO RACES SINCE NOVEMBER 14, 2023 OR WHICH
HAVE NEVER WON FOUR RACES. Three Year Olds, 119 lbs.; Older, 124 lbs. Non-winners Of A Race Since March 14 Allowed 2
lbs. Claiming Price $5,000 (Claiming Races For $4,500 Or Less Not Considered In Eligibility). ( C) Claiming Price: $5,000
Distance: Five Furlongs On The Dirt Current Track Record: (Wonderous Wise - 57.20 - April 11, 1989)
Purse: $14,000
Available Money: $14,000
Value of Race: $14,000 1st $8,400, 2nd $2,800, 3rd $1,400, 4th $700, 5th $420, 6th $280
Weather: Cloudy, 74° Track: Fast
Off at: 3:20 Start: Good for all Timing Method: Electronic
Video Race Replay
Last Raced
Pgm Horse Name (Jockey)
Wgt M/E
PP
Start
3/16
3/8
Str
Fin
Odds Comments
6May24 8FL3
3
Sutton Breeze (Perez, Luis)
122
L bf
2
2
31/2
31
33
13/4
2.70
2p3/8,4w1/4,drvg
30Apr24 3FL1
1
Mass Appeal (Harkie, Heman)
124
L b
5
4
2Head
22
11/2
22
2.40
3p3/8,caught late
21Nov23 1FL5
4
Conformist (Davila, Jr., John)
122
L bf
3
1
11
1Head
21/2
32
1.05*
2p trn,weakened
6Nov23 7FL1
2
Matty's Express (Navarro, Kevin)
122
L f
1
5
51
4Head
42
4Neck
7.40
no threat inside
30Apr24 3FL2
5
Big Bad Bud (Davila, Jr., Michael)
122
L b
4
6
6
6
5Head
52 1/2
15.60
slgsh st,2p turn
30Apr24 3FL4
1A
Smooth Tales (Coa, Keiber)
122
L b
6
3
41
52
6
6
2.40
4w3/8,5w1/4,tired
Fractional Times: 22.86
46.77
Final Time: 59.47
Split Times:
(23:91) (12:70)
Run-Up: 50 feet
Winner:
Sutton Breeze, Chestnut Gelding, by Cajun Breeze out of Sutton Reese, by Factum. Foaled Mar 29, 2019 in Florida.
Breeder: Stonehedge LLC
Owner: Richard Sparling
Trainer: O'Callaghan, Carl
Claiming Prices:
3 - Sutton Breeze: $5,000; 1 - Mass Appeal: $5,000; 5 - Big Bad Bud: $5,000; 1A - Smooth Tales: $5,000;
Scratched Horse(s): Blues City (Veterinarian)
Total WPS Pool: $57,176
Pgm Horse
Win
Place
Show
3
Sutton Breeze
7.40
3.60
2.20
1
Mass Appeal
3.00
2.10
4
Conformist
2.10
Wager Type
Winning Numbers
Payoff
Pool
$0.50 Pick 3
1-5-3 (3 correct)
5.70
8,534
$2.00 Daily Double
5-3
9.00
6,902
$2.00 Exacta
3-1
26.80
35,977
$0.10 Superfecta
3-1-4-2
4.47
12,208
$0.50 Trifecta
3-1-4
13.12
21,007
Past Performance Running Line Preview
Pgm Horse Name
Start
3/16
3/8
Str
Fin
3
Sutton Breeze
2
31
32
31
13/4
1
Mass Appeal
4
21
2Head
11/2
23/4
4
Conformist
1
11
1Head
21/2
32 3/4
2
Matty's Express
5
52 1/2
43
44
44 3/4
5
Big Bad Bud
6
63 1/2
65 1/4
56
55
1A
Smooth Tales
3
41 1/2
53 1/4
66
67 1/2
Trainers: 3 - O'Callaghan, Carl; 1 - Murphy, Timothy; 4 - Englehart, Chris; 2 - Oyola, David; 5 - Maver, Jr., Eduardo; 1A - Murphy, Timothy
Owners:
3 -Richard Sparling; 1 -Timothy P. Murphy; 4 -Sheila J. Englehart; 2 -David Oyola; 5 -Eduardo Maver, Jr.; 1a-Timothy P. Murphy;
Footnotes
SUTTON BREEZE Never far back along the two path into the turn, four wide out of it, asked and bested MASS APPEAL for the win. MASS APPEAL
Tracked along the three path into the turn, challenged at the top of the lane, took the lead and then was caught late. CONFORMIST Away on top, set the
pace along the two path, was collared at the top of the lane, battled and weakened. MATTY'S EXPRESS Unhurried along the rail and then failed to
threaten. BIG BAD BUD Broke sluggishly, lagged back along the two path and failed to threaten. SMOOTH TALES Four wide into the bend, five wide out of
it and tired.
Copyright 2024 Equibase Company LLC. All Rights Reserved.
FINGER LAKE[S - May 14, 2024 - Race 6
MAIDEN CLAIMING - Thoroughbred
FOR MAIDENS, FILLIES AND MARES THREE YEARS OLD AND UPWARD. Three Year Olds, 119 lbs.; Older, 124 lbs. Claiming
Price $5,000. Claiming Price: $5,000
Distance: Five Furlongs On The Dirt Current Track Record: (Wonderous Wise - 57.20 - April 11, 1989)
Purse: $13,500
Available Money: $13,500
Value of Race: $13,500 1st $8,100, 2nd $2,700, 3rd $1,350, 4th $675, 5th $271, 6th $202, 7th $202
Weather: Cloudy, 74° Track: Fast
Off at: 3:49 Start: Good for all Timing Method: Electronic
Video Race Replay
Last Raced
Pgm Horse Name (Jockey)
Wgt M/E
PP
Start
3/16
3/8
Str
Fin
Odds Comments
25Oct23 4FL6
5
Journey of Five (Harkie, Heman)
124
L
4
2
21/2
23
11
11 3/4
10.30
2p trn,kept to whip
30Apr24 1FL2
8
Crystal (Davila, Jr., Michael)
119
L b
7
5
51
31/2
31 1/2
22 1/2
4.60
2p3/8,finished well
30Apr24 5FL6
3
Little Maize (De Diego, Emanuel)
119
L
2
1
11
1Head
21 1/2
31
12.20
rail trn,weakened
19Jan24 3AQU6
6
Love Thyself (Navarro, Kevin)
119
L
5
7
61/2
64
54
4Head
0.65*
slgsh st,no factr insd
30Apr24 5FL4
7
Jen's Kiss (Perez, Luis)
119
L b
6
4
31/2
42 1/2
42
514 1/4
3.20
4w1/4, weakened
30Apr24 1FL5
4
Indyan Penny (Rohena, Jr., Rafael)
124
L b
3
3
41
51
64
62 1/4
32.25
rail trn,tired
30Apr24 1FL4
2
Paulies Angel (Camilo, Carlos)
124
L b
1
6
7
7
7
7
57.75
rail trn,outrun
Fractional Times: 23.28
47.68
Final Time: 1:01.08
Split Times:
(24:40) (13:40)
Run-Up: 50 feet
Winner:
Journey of Five, Dark Bay or Brown Mare, by Golden Ticket out of Better Than Rubies, by Smarty Jones. Foaled May 26, 2019 in New York.
Breeder: Happy Journey Farm
Owner: Padmoutie Singh
Trainer: Huertas, Nirka
Claiming Prices:
8 - Crystal: $5,000; 3 - Little Maize: $5,000; 6 - Love Thyself: $5,000; 7 - Jen's Kiss: $5,000; 4 - Indyan Penny: $5,000; 2
- Paulies Angel: $5,000;
Scratched Horse(s): Brooklyn Rosie (Veterinarian)
Total WPS Pool: $74,981
Pgm Horse
Win
Place
Show
5
Journey of Five
22.60
10.00
6.00
8
Crystal
5.40
3.80
3
Little Maize
4.70
Wager Type
Winning Numbers
Payoff
Pool
$2.00 Daily Double
3-5
122.50
7,110
$2.00 Exacta
5-8
140.00
76,616
$0.10 Superfecta
5-8-3-6
114.50
31,665
$0.50 Trifecta
5-8-3
364.25
49,689
Past Performance Running Line Preview
Pgm Horse Name
Start
3/16
3/8
Str
Fin
5
Journey of Five
2
21
2Head
11
11 3/4
8
Crystal
5
53
33
32 1/2
21 3/4
3
Little Maize
1
11
1Head
21
34 1/4
6
Love Thyself
7
64
67
56
45 1/4
7
Jen's Kiss
4
31 1/2
43 1/2
44
55 1/4
4
Indyan Penny
3
42
56
610
619 1/2
2
Paulies Angel
6
74 1/2
711
714
721 3/4
Trainers: 5 - Huertas, Nirka; 8 - Murphy, Timothy; 3 - Dixon, Linda; 6 - Buckley, Jonathan; 7 - Ferraro, M.; 4 - Clarke, Matthew; 2 - Sells, Rachel
Owners:
5 -Padmoutie Singh; 8 -Edwin J. Schatzel; 3 - Dixon, Linda K. and Alejandro, Hector M.; 6 - Windylea Farm, LLC; 7 - Paradise Farms Corp.; 4
-Matthew Clarke; 2 -Luanne Bianchi;
Footnotes
JOURNEY OF FIVE Tracked along the two path, challenged at the top of the lane, shook clear some and under pressure proved best. CRYSTAL Unhurried
along the two path into the turn, three path leaving it, responded and finished well. LITTLE MAIZE Away on top, set the pace along the rail, was collared at
the top of the lane, chased and weakened. LOVE THYSELF Broke sluggishly, two path on the turn with one best and failed to threaten inside. JEN'S KISS
Tracked along the three path, four wide into the lane and weakened. INDYAN PENNY Saved ground and tired. PAULIES ANGEL Saved ground while
always outrun.
Copyright 2024 Equibase Company LLC. All Rights Reserved.
FINGER LA/KES - May 14, 2024 - Race 7
STARTER OPTIONAL CLAIMING - Thoroughbred
FOR THREE YEAR OLDS AND UPWARD WHICH HAVE STARTED FOR A CLAIMING PRICE OF $5,000 OR LESS SINCE MAY
14, 2022 OR OPTIONAL CLAIMING PRICE $8,000. Three Year Olds, 120 lbs.; Older, 124 lbs. Non-winners Of A Race Since March
14 Allowed 2 lbs. Claiming Price $8,000. ( C) Claiming Price: $8,000
Distance: Five Furlongs On The Dirt Current Track Record: (Wonderous Wise - 57.20 - April 11, 1989)
Purse: $20,000
Available Money: $20,000
Value of Race: $20,000 1st $12,000, 2nd $4,000, 3rd $2,000, 4th $1,000, 5th $600, 6th $400
Weather: Cloudy, 74° Track: Fast
Off at: 4:19 Start: Good for all Timing Method: Electronic
Video Race Replay
Last Raced
Pgm Horse Name (Jockey)
Wgt M/E
PP
Start
3/16
3/8
Str
Fin
Odds Comments
20Nov23 8FL4
1
Coach Bahe (Navarro, Kevin)
122
L b
1
1
1Head
24
11
11 1/2
12.40
shrp st,rail,rddn out
21Nov23 8FL2
3
Devious Banker (Worrie, Andre)
122
L bf
3
3
31/2
3Head
32 1/2
22 1/4
6.60
rail3/8,3p1/4,rallied
14Nov23 3FL4
4
Number One Dillon (Harkie, Heman)
122
L bf
4
2
21
1Head
23
32 1/4
6.00
2p trn,weakened
6May24 8FL5
6
Invaluable Will (Rohena, Jr., Rafael)
122
L b
5
4
6
6
5Head
42
20.00
3p3/8,4w1/4,no threat
28Mar24 8AQU4
2
Winning Drive (Davila, Jr., John)
122
L b
2
6
51/2
52
6
58 3/4
9.90
ckd st,raili3/8,wknd
7Apr24 5LRL2
7
Nottoway (Coa, Keiber)
122
L bf
6
5
42 1/2
43
41 1/2
6
0.35*
in distrs,eased1/16out
Fractional Times: 22.56
46.12
Final Time: 59.17
Split Times:
(23:56) (13:05)
Run-Up: 50 feet
Winner:
Coach Bahe, Dark Bay or Brown Gelding, by Take Charge Indy out of Bauble, by Tale of the Cat. Foaled Apr 08, 2017 in Kentucky.
Breeder: Merriebelle Stable, LLC
Owner: Windylea Farm, LLC
Trainer: Buckley, Jonathan
1 Claimed Horse(s): Winning Drive
New Trainer: John A. Grabowski
New Owner: John A. Grabowski
Claiming Prices:
6 - Invaluable Will: $8,000; 2 - Winning Drive: $8,000;
Scratched Horse(s): Ach Du Lieber (Veterinarian)
Total WPS Pool: $56,968
Pgm Horse
Win
Place
Show
1
Coach Bahe
26.80
11.00
7.50
3
Devious Banker
6.10
5.00
4
Number One Dillon
5.90
Wager Type
Winning Numbers
Payoff
Pool
$2.00 Daily Double
5-1
297.50
11,172
$2.00 Exacta
1-3
124.00
47,723
$0.10 Superfecta
1-3-4-6
134.65
18,694
$0.50 Trifecta
1-3-4
245.50
30,110
Past Performance Running Line Preview
Pgm Horse Name
Start
3/16
3/8
Str
Fin
1
Coach Bahe
1
1Head
2Head
11
11 1/2
3
Devious Banker
3
31
34
34
21 1/2
4
Number One Dillon
2
2Head
1Head
21
33 3/4
6
Invaluable Will
4
64 1/2
69 1/4
58
46
2
Winning Drive
6
54
57 1/4
68
58
7
Nottoway
5
41 1/2
44 1/4
46 1/2
616 3/4
Trainers: 1 - Buckley, Jonathan; 3 - Pettine, James; 4 - Huertas, Nirka; 6 - Breed, Debra; 2 - Sells, Rachel; 7 - Reed, Lisa
Owners:
1 - Windylea Farm, LLC; 3 - Cole, Paul S, and Cole, Autumn S.; 4 -Elimay Moreno; 6 -Debra A. Breed; 2 - Second Chance Racing (David
Santonas); 7 -Marcello Rosa;
Footnotes
COACH BAHE Away best, volleyed for the lead along the rail, kicked clear in the lane and was ridden out. DEVIOUS BANKER In hand along the rail into the
turn, three path out of it and rallied. NUMBER ONE DILLON Volleyed for the lead along the two path, chased and weakened. INVALUABLE WILL
Unhurried, three path into the turn, four wide out of it and failed to threaten. WINNING DRIVE Checked at the start, saved ground, angled out and
weakened. NOTTOWAY Well placed along the two path, three path into the lane, angled out, appeared in distress leaving the furlong marker and then was
eased through the final sixteenths.
Copyright 2024 Equibase Company LLC. All Rights Reserved.
FINGER
*LAKES - May 14, 2024 - Race 8
CLAIMING - Thoroughbred
FOR THREE YEAR OLDS AND UPWARD WHICH HAVE NEVER WON TWO RACES. Three Year Olds, 119 lbs.; Older, 124 lbs.
Claiming Price $5,000. (NW2 L) Claiming Price: $5,000
Distance: Five Furlongs On The Dirt Current Track Record: (Wonderous Wise - 57.20 - April 11, 1989)
Purse: $13,500
Available Money: $13,500
Value of Race: $13,500 1st $8,100, 2nd $2,700, 3rd $1,350, 4th $675, 5th $271, 6th $202, 7th $202
Weather: Cloudy, 74° Track: Fast
Off at: 4:47 Start: Good for all except 6 Timing Method: Electronic
Video Race Replay
Last Raced
Pgm Horse Name (Jockey)
Wgt M/E
PP
Start
3/16
3/8
Str
Fin
Odds Comments
20Aug23 6MTH3
8
East Coast Girl (Worrie, Andre)
124
L bf
7
7
11
12 1/2
110
112 1/2
0.05*
2p trn,easily
20Nov23 3FL5
2
M. C. Double R (Davis, Jacqueline)
124
L
1
4
51 1/2
42
43
2Nose
16.80
3p trn,up for place
13Nov23 5FL1
7
Zuccarace (Davila, Jr., John)
124
L bf
6
3
2Head
21 1/2
21 1/2
31 1/2
16.40
3p trn,missd place
7Nov23 6FL8
3
Noah's Destiny (Fret, Steven)
124
L bf
2
1
31
31
31/2
42
35.25
weakened inside
6May24 2FL5
5
She Speaks Well (Berrios, John)
124
L b
4
5
61/2
7
7
5Head
36.50
2p trn,no factor
10Oct23 5FL6
4
Hardly Working (Cruz, Joel)
124
L bf
3
6
7
64
51
63/4
31.00
3p trn,no threat
20Nov23 1FL7
6
Eight Sunset Drive (Rohena, Jr., Rafael)
124
L bf
5
2
41 1/2
51
62
7
91.00
bobbled st,2p trn
Fractional Times: 23.09
46.55
Final Time: 58.94
Split Times:
(23:46) (12:39)
Run-Up: 50 feet
Winner:
East Coast Girl, Dark Bay or Brown Ridgling, by Laoban out of Myakka City, by City Place. Foaled Jan 30, 2020 in New York.
Breeder: Mr Armore Stables
Owner: James A. Riccio
Trainer: Englehart, Jeremiah
1 Claimed Horse(s): East Coast Girl
New Trainer: Mark L. Tasso
New Owner: Island View Farm
Claiming Prices:
8 - East Coast Girl: $5,000; 7 - Zuccarace: $5,000; 3 - Noah's Destiny: $5,000; 5 - She Speaks Well: $5,000; 6 - Eight
Sunset Drive: $5,000;
Scratched Horse(s): Tater and Tot (Veterinarian)
Total WPS Pool: $100,444
Pgm Horse
Win
Place
Show
8
East Coast Girl
2.10
2.10
2.10
2
M. C. Double R
4.80
2.90
7
Zuccarace
2.40
Wager Type
Winning Numbers
Payoff
Pool
$0.50 Pick 3
5-1-8 (3 correct)
144.25
17,907
$0.50 Pick 4
3-5-1-1/8 (4 correct)
803.50
23,573
$0.50 Pick 5
ALL-3-5-1-1/8 (5 correct)
699.25
27,978
$1.00 Pick 6
1-ALL-3-5-1-1/8 (5 correct)
23.10
0
$1.00 Pick 6
1-ALL-3-5-1-1/8 (6 correct)
2,695.50
13,799
$2.00 Daily Double
1-8
34.40
22,863
$2.00 Exacta
8-2
14.00
93,242
$0.10 Superfecta
8-2-7-3
6.72
38,115
$0.50 Trifecta
8-2-7
11.70
60,278
Past Performance Running Line Preview
Pgm Horse Name
Start
3/16
3/8
Str
Fin
8
East Coast Girl
7
11
12 1/2
110
112 1/2
2
M. C. Double R
4
53 1/2
45
412
212 1/2
7
Zuccarace
3
21
22 1/2
210
312 1/2
3
Noah's Destiny
1
31
34
311 1/2
414
5
She Speaks Well
5
65
712
718
516
4
Hardly Working
6
75 1/2
68
515
616 1/4
6
Eight Sunset Drive
2
42
57
616
717
Trainers: 8 - Englehart, Jeremiah; 2 - Huertas, Nirka; 7 - Englehart, Chris; 3 - Clarke, Matthew; 5 - Maver, Jr., Eduardo; 4 - McClung, Shayla; 6 - Cook,
Robert
Owners:
8 -James A. Riccio; 2 - Eduardo Flores Stables LLC; 7 - My Purple Haze Stables; 3 - BoBo Racing Group; 5 -Eduardo Maver, Jr.; 4 -Shayla B.
McClung; 6 - Cook, Toni and Yott, Corie A.;
Footnotes
EAST COAST GIRL Sent to the front, showed the way along the two path and then widened to win easily. M. C. DOUBLE R In hand along the three path,
eased out and was along for the place. ZUCCARACE Tracked along the three path, chased and missed the place. NOAH'S DESTINY Tracked along the rail
and weakened inside. SHE SPEAKS WELL Lagged back, two path on the turn, was not a factor. HARDLY WORKING Three path on the turn, was not a
threat. EIGHT SUNSET DRIVE Bobbled at the start, two path on the turn and tired.
Total Attendance: 0
Handle: $1,512,698
Copyright 2024 Equibase Company LLC. All Rights Reserved.
